date;executor;region;equipment;node;notes_on_the_operation_of_the_equipment;measures_taken;comments
18.10.2016;Котлярский С.;Резиносмешение;INTAKE;C.black silos transport/ Транспортировка сажи в силосы ;В RAIL HOPER контейнере остался старый код сажи. Невозможно начать загрузку нового типа сажи. На контейнере горит MIN Level. Надпись ПУСТОЙ.;Задали на разгрузочной станции такой же тип сажи, что и RAIL контейнере.Дорога не складывается.  В поле Разгрузочной станции выбрали другой шифр по штрих-коду. После этого сложилась старая дорога и появилась надпись ОСТАНОВИВШИЙСЯ.  Выкл. Штрихкод. Опять ввели на Разгрузочной станции одинаковые штрихкоды. После этого опять включили разрешение на штрихкод. После этого пошла ОЧИСТКА.;
09.03.2017;Котлярский С.;Резиносмешение;INTAKE;Oil tanks /    Емкости масла;Необходимо сделать, чтобы при открытии ручного клапана 434B1 внизу приемного танка не отключался насос циркуляции.;В блоке FB42 в NW 10 заремил ON M69.0;
24.07.2017;Котлярский С.;Резиносмешение;INTAKE;Silica transpor/ Транспортировка силики в расход. Бункеры;Во время транспортировки около разгрузчика (ROTARE FEEDER) появлется треугольник с восклицательным знаком и надпись давление.;Это связано с датчиком давления 921S1. Во время подачи воздуха датчик должен быть в 1.  Выкрутили датчик в минус, а кран воздуха приоткрыли.;
11.08.2017;Котлярский С.;Резиносмешение;INTAKE;C.black silos transport/ Транспортировка сажи в силосы ;Не стартует транспортировка. Код не выбирается не в ручную не через сканер. ;В окошке статуса пневмотранспорта(внизу на картинке) пустое поле. Не закончилась очистка после последней транспортировки. Останов цикла. Запуск очистки. После этого все запускается. ;
01.01.2015;Головин А.;Резиносмешение;INTAKE;C.black transport/ Транспортировка тех.углерода  в расход. бункеры;Не работает мышь на панели оператора через ATEN;При диагностике установлено, что при замене ATEN у оператора отключается все управление и монитор. При возвращении родного ATEN в серверной не работает только мышь. В диспетчере устройств драйвер PS/2 выдает ошибку Code 24. Пришлось открывать в реестр и вручную искать управление портами PS/2 (i8042prt). Нашел в разделе HKEY_LOCAL MACHINE -> Services -> i8042prt. В разделе Default установил значение по умолчанию 1.;
01.01.2015;Золотарева Н.;Резиносмешение;Mix 1.1 BY11 GK320;Aspiration/Аспирация;Ошибка по аспирации. Сработал датчик заполнения бункера, куда ссыпается сажа из фильтра;В ручном режиме ссыпали на весы и с весов в BicBag;
01.01.2015;Золотарева Н.;Резиносмешение;Mix 1.1 BY11 GK320;Batchoff/ Выгрузка;На выгрузке стол поднимается вверх и транспортерная лента начинает двигаться без резины и останова ;В проекте VMI сбросили шаги и заново задали 1-ый шаг( при этом все чегото дергали и жали-поэтому осталось непонятным);
01.01.2015;Котлярский С.;Резиносмешение;Mix 1.1 BY11 GK320;Dosing C.black/ Дозирование тех.углерода;Не работает дозировка сажи- ошибка на приводе аспирации (кабинет +S1);Перезапустили частотник соответствующим пускателем (привод 752V1 - пускатель 752Q1(вверху слева);
01.01.2015;Котлярский С.;Резиносмешение;Mix 1.1 BY11 GK320;Main Motor/ Главный двигатель;"Ошибка по ""Main motor"", синяя кнопка (сброс аварии) горит постоянно на пульте- 2этаж Внизу (Ансальдо) не собирается PILZ.";На вальцах отжали кнопку на тросике безопасности;
01.01.2015;Золотарева Н.;Резиносмешение;Mix 1.1 BY11 GK320;Dosing C.black/ Дозирование тех.углерода;Проблемы с весами Carbon black;Проводили калибровку весов (гири по 20 кг)После калибровки провели весы функцией тест.Тест прошел с нулевыми значениями по дельта значок аварии не сбросился. Нажали кнопку подтверждение аварии и подержали, после чего авария сбросилась;
01.01.2015;Котлярский С.;Резиносмешение;Mix 1.1 BY11 GK320;Batchoff/ Выгрузка;На разгрузке не работает захват подачи резины на конвейер;Поправили датчик 715В1-715В2 ( I 80.1 ) датчик на определение материала перед укладчиком- находится  вверху ;
01.01.2015;Золотарева Н.;Резиносмешение;Mix 1.1 BY11 GK320;Aspiration/ Аспирация;На аспирации значoк  вентилятора- красный;"Нажать  ""квадратные очки"", нажать подтверждение аварийного сигнала на пульте , через 5 сек в окне ""очков"" появится кнопка Reset,нажать ее. Ошибка должна сброситься.";
01.01.2015;Котлярский С.;Резиносмешение;Mix 1.1 BY11 GK320;Main Motor/ Главный двигатель;Машина не запускается. Актуальных ошибок (красных) нет . Но двигатель не запускается. В окне исходного состояния в красный цвет окрашен прямоугольник - вспомогательные цепи, Main motor- безопасность.;Перезапустили пусковые панели частотных преобразователей. Все заработало;
01.01.2015;Золотарева Н.;Резиносмешение;Mix 1.1 BY11 GK320;Computer;Магма зависает на выборе рецепа. После нажатия кнопки вставить крутится загрузка и все;Перегрузила компьютер. Все заработало.;
01.01.2015;Золотарева Н.;Резиносмешение;Mix 1.1 BY11 GK320;Dosing silica/ Дозирование силики;Нет навешивания весов. Актуальных ошибок на экране нет.;"Сбросила ошибки через кнопку подтверждение аварии на пульте оператора и задала старт дозировки из зкрана ""команды"". Навесились только сажа и масло, silica- навеска не пошла. На экране калибровки ошибка теста взвешивания.Проделала  тест взвешивания еще раз. Тест прошел благополучно. Silica навесилась.";
01.01.2015;Золотарева Н.;Резиносмешение;Mix 1.1 BY11 GK320;Batchoff/ Выгрузка;На выгрузке нет подъема прижимной планки      ( где укладчик), задняя от панели.  ;Выход Q85- сработал правильно. На клапане 760Y2 была откручена фишка. Прикрутили все заработало.;
01.01.2015;Золотарева Н.;Резиносмешение;Mix 1.1 BY11 GK320;Batchoff/ Выгрузка;На выгрузке стол поднимается вверх и транспортерная лента начинает двигаться без резины и останова ;Заправили резину,цикл укладки прошел, поддон опустился и дальше работало правильно.;
01.01.2015;Котлярский С.;Резиносмешение;Mix 1.1 BY11 GK320;Computer;Не светится монитор  на 1 этаже;Был выключен компьютер в серверной (slave). Включили.;
01.01.2015;Котлярский С.;Резиносмешение;Mix 1.1 BY11 GK320;Batchoff/ Выгрузка;"На выгрузке, в атоматическом режиме, стол с платформой начинает подниматься и останавливается не доходя до нужного положения. На экране панели выводится сообщение : "" проверьте датчик 811В4""";На самом деле был сбит датчик на цилиндре прижимной планки 760В6 (I80.6) Выставили правильно его положение и все заработало.;
01.01.2015;Золотарева Н.;Резиносмешение;Mix 1.1 BY11 GK320;Dosing silica/ Дозирование силики;Нет дозирования на весах СИЛИКИ, не проходит тестовое взвешивание.;Проверка и калибровка  весов силики( увеличили вес тестовой гири большего веса на 100 гр (75.100);
01.01.2015;Котлярский С.;Резиносмешение;Mix 1.1 BY11 GK320;Main Motor/ Главный двигатель;Останов главного привода во время работы. Не удается запустить главный привод.Ошибки на PLC. Нет питания на приводах. Нет входного напряжения 600 В. в шкафу на автоматах 1ЩР1/1 и 1ЩР1/2. Нет питания от ЦРП. ;После включения напряжения на ЦРП 1, главный привод был запущен;
01.01.2015;Котлярский С.;Резиносмешение;Mix 1.1 BY11 GK320;Main Motor/ Главный двигатель;Останов главного привода во время работы. Ошибка Fault Feeld Drive 2. Нет сигнала ZERO SPEED(FIELD OK) на модуле SPAM управления обмотками возбуждения двигателя. Сгорел предохранитель G2+S4 F51.2 (20 А) в цепи модуля SPAM. ; Замена предохранителя. Проверили модуль SPAM из ЗИПа. Запустиь не удалось. При включении сигнал ZERO SPEED кратковременно появляется и пропадает.;
01.01.2015;Золотарева Н.;Резиносмешение;Mix 1.1 BY11 GK320;Main Motor/ Главный двигатель;Не удается запустить главный двигатель после выключения и включения питания главным автоматом. Около изображения двигателя в МАГМЕ появились треугольники с восклицательными знаками. Нет напряжения на некотроых фазах на переключателе индикатора фаз на гл. шкафу. Выбивает автоматы охлажд. воздуха на двигатель.;Сгорел предохранитель 100А в главном переключателе. Замена предохранителя. Замечено плохое срабатывание дополнительного контактора рядом с гл. переключателем. Профилактика контактора.;
01.01.2015;Золотарева Н.;Резиносмешение;Mix 1.1 BY11 GK320;Batchoff/ Выгрузка;"Нет выгрузки, на панели сообщение ""камера охлаждения заполнена"". До этого был козел.";В камере охлаждения освободили датчик (последний), вытягивали резину, пока не загорелся светодиод на датчике, затем пришлось сбросить метку в программе М95.0;
01.01.2015;Котлярский С.;Резиносмешение;Mix 1.1 BY11 GK320;Main Motor/ Главный двигатель;Останов главного привода во время работы. Ошибка Fault Feeld Drive 2. Нет сигнала ZERO SPEED(FIELD OK) на модуле SPAM управления обмотками возбуждения двигателя. Сгорел предохранитель G2+S4 F51.1 (20 А) в цепи модуля SPAM. ;Замена быстродействующего предохранителя на предохранитель обычного типа 25А.;
01.01.2015;Золотарева Н.;Резиносмешение;Mix 1.1 BY11 GK320;Batchoff/ Выгрузка;Не работает конвейер подачи резины на 2-ой этаж. Сгорел привод Lenze 160U1. Сгорел модуль Profibus на приводе. ;Замена привода и модуля Profibus. Загрузка параметров.;Небыло индикации ни на самом приводе, ни на модуле. После установки нового модуля Profibus, необходимо поменять адрес ( заводская установка - адрес 3)
01.01.2015;Котлярский С.;Резиносмешение;Mix 1.1 BY11 GK320;Batchoff/ Выгрузка;Не запускается линия. Горит авария на маленьком пульте. Ругается на датчик цилиндра взятия образца 580 B5.  Цилиндр находится  в нижнем положении.;Клапаном 580 Y2 принудительно подняли цилиндр вверх. Аварию сняли и линия готова к работе.;(на панели устройство взятия образца   обозначается как  ПУАНСОН).
01.01.2015;Золотарева Н.;Резиносмешение;Mix 1.1 BY11 GK320;Batchoff/ Выгрузка;На разгрузке не работает захват подачи резины на конвейер;Поправили датчик 715В1-715В2 ( I 80.1 ) датчик на определение материала перед укладчиком- находится  вверху (определяется  как инверсный);
01.01.2015;Котлярский С.;Резиносмешение;Mix 1.1 BY11 GK320;Main Motor/ Главный двигатель;"Невозможно запустить главный двигатель. Все на готовности, но при попытке запуска пропадает сигнал со SPAM ""Zero Field"" на обоих блоках.";Обнаружено, что somebody украл 2 энкодера с двигателей. Установка  энкодеров другого типа. ;Для этих энкодеров пришлось поменять на клемниках в шкафу провода(сигналы А В) местами.
01.01.2015;Золотарева Н.;Резиносмешение;Mix 1.1 BY11 GK320;Computer; На мониторе на 2-м этаже отображается экран с которого нет выхода.;"По удаленному досступу , на PIVOR skm закрыл Workspace (""Магма"" перезагрузилась)";
01.01.2015;Золотарева Н.;Резиносмешение;Mix 1.1 BY11 GK320;Batchoff/ Выгрузка;Остановилась выгрузка резины на поддон, не сбрасывается защита аварийного реле .На панели  сообщение о проблеме безопасности (дверь и нож).;Нет сигнала  с контакта аварийного реле на ноже. Восстановили контакт реле.Выгрузка продолжилась;
01.01.2015;Котлярский С.;Резиносмешение;Mix 1.1 BY11 GK320;Hydraulic unit/ Гидравлика;Не опускается пресс (RAM).;С контроллера Telco сигнал на опускание приходит на Siemens S7 224. С S7 224 идет аналоговый сигнал           (-10V) на пропорциональный клапан упрвавления гидравликой. На TD200 на канале А давление 220 bar, а на канале B - 3 bar. После замены пропорционального клапана все работает. ;
01.01.2015;Золотарева Н.;Резиносмешение;Mix 1.1 BY11 GK320;Dosing oil/ Дозирование масла;Не работает вентилятор в шкафу дозировки масла;"На экране оператора по значку ""Ссылка HW"" была ошибка  ""нет обратной связи контактора"" Выбило автомат 407Q1  в шкафу +30 ( на 1м этаже). Включили, работает.";
01.01.2015;Котлярский С.;Резиносмешение;Mix 1.1 BY11 GK320;Main Motor/ Главный двигатель;"Не запускается главный двигатель. В Magme ""Ошибка поля двигатель 1"". На модуле SPAM пропадает Zero Field сразу после попытки пуска двигателя.";Обрыв провода в разъеме энкодера(перемычка между D - E).  ;
01.01.2015;Золотарева Н.;Резиносмешение;Mix 1.1 BY11 GK320;Computer;Не светится монитор  на 1 этаже.;Нет питания на модуле KVM REMOTE Монитора и на автомате 26F1 в шкафу +62. Выбило автомат 12Q1 в шкафу +60 в силовой (шкафы TSE+RD);"Одновременно с этим была ошибка обратной связи привода 60A1. Ссылка на автомат 62Q1. После включения монитора сбросил ошибки. В окошке ""ссылка HW"" задал восстановление. Ошибка снялась."
01.01.2015;Золотарева Н.;Резиносмешение;Mix 1.1 BY11 GK320;Batchoff/ Выгрузка;Не сбрасывается зона безопасности со стороны подачи поддонов;Поврежден столб SICK 801B1. Не собирается схема сброса защиты 787К1 (шкаф Ф-27). Принудительно включили реле 801К5, 801K6 подав сигнал с другого столба. Зону подачи поддонов закрыли решеткой.;
01.01.2015;Золотарева Н.;Резиносмешение;Mix 1.1 BY11 GK320;Computer;На 1м этаже с панели оператора не вводится пароль оператора , вместо имени абракадабра.;Перегрузили компьютер PIVORSKS;
01.01.2015;Золотарева Н.;Резиносмешение;Mix 1.1 BY11 GK320;Main Motor/ Главный двигатель;Не запускается главный привод.Ошибка Fault Feeld Drive1. и Fault Feeld Drive2;Перезапустили пусковые панели частотных преобразователей.( одновременное нажатие 3х кнопок) Все заработало;
01.01.2015;Котлярский С.;Резиносмешение;Mix 1.1 BY11 GK320;Main Motor/ Главный двигатель;Останов главного привода во время работы. Ошибка Fault Feeld Drive 2. Нет сигнала ZERO SPEED(FIELD OK) на модуле SPAM управления обмотками возбуждения двигателя. Сгорел предохранитель G2+S4 F51.2 (20 А) в цепи модуля SPAM. ;Замена предохранителя.;Быстродействующий предохранитель взяди со 2-ой машины. Вместо него на 2-ой машине поставили один обычный 25А
27.02.2014;Котлярский С.;Резиносмешение;Mix 1.1 BY11 GK320;Main Motor/ Главный двигатель;Во время работы линии  остановка привода        № 1.Ошибка P.C. Пониженное напряжение линии;Прибавили напряжение на подстанции до 660 В в холостом режиме смесителя.;Во время работы смесителя напряжение просаживается до 580В. После повышения на подстанции напряжение во время работы не ниже 600 В.
04.05.2014;Котлярский С.;Резиносмешение;Mix 1.1 BY11 GK320;PLC;На станции 1103A2(ET200) мигает BF(весы проверочные силики не готовы, аспирация не работает, задвижки многих клапанов на экране не закр/не открыты( по диагонали)).;Замена коммуникационного процессора, замена коннектора, замена SIWAREX U, проверка напряжений… результата не дали. После загрузки HARDWARE все заработало. ;Было замечено, что если включить коммуникационный процессор без остальных модулей, то на нем не горит SF, хотя на других коммун. модулях при таки же действиях   SF сразу загорается и в hardware появл. указание на отсут модули. После перезагрузки HARDWARE пришлось вкл/выкл питание, иначе была ошибка на всех SINAMICS.
01.06.2014;Котлярский С.;Резиносмешение;Mix 1.1 BY11 GK320;Batchoff/ Выгрузка;"Не работает нож на укладчике. Лампочка Q85. ""Окончание цикла укладки"" горит, нож не двигается. Сгорел преобразователь LENZA 770U1. Модуль PROFIBUS остался целым.";Замена преобразователя. Загрузка параметров.;"Для справки: Лампочка ""Окончание цикла укладки"" гаснет  после отреза и опускания стола вниз."
26.07.2014;Котлярский С.;Резиносмешение;Mix 1.1 BY11 GK320;Mixer/ Смеситель;Ошибка насоса консистентной смазки 37M1. Насос горит красным. Превышение цикла смазки 05E26.5.  Ошибка не сбрасывается.;При переводе в ручной режим и подтверждении аварийных сигналов кнопкой на пульте оператора ошибка не сбрасывается. Сигнал 05E26.5 нормально закрытый. Сняли провод с входного модуля. Ошибка сбросилась. Вернули провод. Несколько раз включили насос в ручном режиме. Сначала появлялась ошибка, но сбрасывалась с пульта. После второго запуска датчик сработал. Перевели в автомат. ;
