date;executor;region;equipment;node;notes_on_the_operation_of_the_equipment;measures_taken;comments
01.01.2015;Юдаков А.;Резиносмешение;Mix 1.1 BY11 GK320;Dosing silica/ Дозирование силики;Силика не подается в 1 расходный бункер. ;"Остановил автоматическую загрузку в магме, кнопкой stop. Возобновил загрузку. Появилась ошибка: ""Silica transport: By11 DAYBIN 1 Parameter not valid"". Зашел под паралем maintenance в Параметры бункеров. Выбрал каждый из 3-х бункеров с силикой и нажал изменить а затем сохранить. Процесс возобновился. ";Перед этим перегрузилл SAM и SAS, из-за потери связи.
01.01.2015;Юдаков А.;Резиносмешение;Mix 1.1 BY11 GK320;Mixer/ Смеситель;Заменен кабель термопары ;;
01.01.2015;Золотарева Н.;Резиносмешение;Mix 1.1 BY11 GK320;Mini PC;TSE;Заменили Mini PC, установили из ЗИПа с LINUXом;
01.01.2015;Юдаков А.;Резиносмешение;Mix 1.1 BY11 GK320;Mixer/ Смеситель;Заменен кабель термопары и сама термопара;;
04.05.2017;Котлярский С.;Резиносмешение;Mix 1.1 BY11 GK320;Mixer/ Смеситель;Замена кабеля термопары на нижнем затворе;;Длина одного кабеля для подкючения термопары 5 м. Сделан запас по 5 м на каждый кабель для быстрой замены проблемного участка. 
18.05.2017;Котлярский С.;Резиносмешение;Mix 1.1 BY11 GK320;Hydraulic unit/ Гидравлика;Не опускается пресс.;Проверка дискретных сигналов от TELCO на входе контроллера 224 и выходного аеалогового  сигнала на сервоклапан. На входе сигнал присутствует. На аналоговом  выходе при команде на опукание около +2.26 В. Замена серво клапана. Результата нет. Замена аналогового модуля. После этого на аналоговом выходе напряжение около (-7 В). Результата нет. Проверка сигнала на PEW154. Проверка цепи сигала на разрешение движения 53Y1. Повторная замена сервоклапана на новый. Заработало. ;Если снять фишку на сервоклапане и нажать на пульте пресс вниз, то пресс опустится. При опускании пресса вниз значение на аналоговом выходе на сервоклапан должно быть примерно (-7В)  /если считать контакт 5209 плюсовым, а 5210 минусовым. При достижении положения становится 0. При команде пресс вверх сначала +7В, а при достижении  верхнего положения 0. Сигнал на PEW154 может менятся, но при этом не меняется в MAGME и это нормально.    
16.06.2017;Котлярский С.;Резиносмешение;Mix 1.1 BY11 GK320;Main Motor/ Главный двигатель;Останов одного из приводов по ошибке P.E. Leg_F. После сброса ошибки привод работает нормально.Иногда в Магме проскакивает ошибка Feedback lost. Также замечено, что во время работы на панели привода вместо F(вращение вперед) появляется 0 (привод в состоянии нулевой скорости). Показания энкодера на панельке сильно прыгают.;Поменяли энкодеры двигателей местами и ошибка перешла на другой привод. Замена неисправного энкодера.;
01.01.2015;Юдаков А.;Резиносмешение;Mix 1.1 BY11 GK320;Dosing C.black/ Дозирование тех.углерода;Сбой цикла из=за выключения питания. На весах остался заданный вес и рисунок сажи на весах. На конвейерах остался материал.;Правильный выход из ситуации: Перевести заслонку сброса с весов в мешок в положение вне линии. Сбросить аварии. Заслонка должна окр. В белый цвет. Прицепить мешок. Открыть нижнию заслонку , потом верхней заслонкой порциями по 10 кг. (открывать и сразу закрывать) сбрасывать в мешки. В конце клапанами воздуха встряхнуть остатки сажи. Закрыть заслонки. Зайти в меню весов и нажать СБРОС НЕПРАВИЛЬНОГО ВЗВЕШИВАНИЯ. На весах пропадет рисунок сажи. Вернуть заслонку сброса обратно. Она загориться зеленым цветом.  Убираем материал с конвейеров. Заходим в меню ленточных весов и нажим. ПОДГОТОВКА КОНВЕЙЕРА, СБРОС ВЗВЕШИВАНИЯ КОНВЕЙЕРА И ВЕСОВ. Возможно и ВЕСЫ ВОССТАНОВЛЕНИЕ. Должно везде быть МВОБОДНО или ПУСТО. После этого в автомат. Снимаем рецепт. Убедиться\. что все весы пустые. Задать новый рецепт и т.д.;
01.01.2015;Котлярский С.;Резиносмешение;Mix 1.1 BY11 GK320;Computer;Компьютер PIVORASS. Ошибки HDD на порте 1 (переназначенные секторы диска);Замена жеского диска на новый. Перестроение массива;
01.01.2015;Котлярский С.;Резиносмешение;Mix 1.1 BY11 GK320;Computer;Компьютер PIVORSKM. Ошибки HDD на порте 1 (переназначенные секторы диска);Замена жеского диска на новый. Перестроение массива;
01.01.2015;Котлярский С.;Резиносмешение;Mix 1.1 BY11 GK320;Dosing silan/ Дозирование силана;"При дозировании силана набранный вес в ""шприце"" остается в нуле. Значение перемещения поршня растет. При этом на весах 34,5 кг. и ""треугольник!"" максимум.";Проверка работы оборудования. Заметили, что при дозировании значение веса на весах не уменьшается. Весы неправильно оттарированы. Реально силана мало на весах и он не попадает в шприц. Тарировка весов. Проверка веса гирями.  Запуск в работу.;При тарировке весов они не должны быть совсем пустыми. Надо долить силан так, чтобы он достигал уровня трубки через которую он попадает в шприц. Около 20 кг добавить на пустые весы и после этого нажать тарировка. Может появиться ошибка: вне диапазона. Нажать восстановление весов.
01.01.2015;Котлярский С.;Резиносмешение;Mix 1.1 BY11 GK320;Dosing silan/ Дозирование силана;Весы силана набраны (18 кг), но дозирование не идет. Сообщение: Silane scale material required not found;"Рекомендация от Telco: Previous scan with barcode gave a wrong result and lock silane circuit. This stopped the dosing in the line.
Procedure to restore are:
• Unlock the line, from page material inside the silo, in Services
• Make a right scan on the feeding station (scan by barcode or by window) as per attached
";
30.10.2018;Юдаков А.;Резиносмешение;Mix 1.1 BY11 GK320;Mixer/ Смеситель;Замена термопары на нижнем затворе.;Термопара HF. Расстояние от фланца до кончика термопары 244 мм.;
31.03.2019;Головин А.;Резиносмешение;Mix 1.1 BY11 GK320;Main Motor/ Главный двигатель;"Не запускается главный двигатель смесителя. Выпадает в ошибку -fault storage temperature A drive 2.; ";Проверка терморезостора, протяжка контактов , проверка реле датчика температуры, проверка сигнала на модуле контроллера ( все сигналы есть, температуры на реле в норме 36 градусов). Сброс ошибок на панели оператора, проверка работы - работа машины восстановлена.;Датчик температуры В находиться с задней стороны мотора. Датчик температуры А находиться с передней стороны мотора. Очень долго сбрасывалась ошибка не смотря на то что входной сигнал был.
07.11.2019;Головин А.;Резиносмешение;Mix 1.1 BY11 GK320;Mixer/ Смеситель;Работа по запросу службы качества, настройка движения пресса на последней фазе (при выгрузке);"Внес изменения в проекте в блоке FC260 network 2 изменил параметр DB9.DBW 44 на 526 (было 1000); FB111 network 14 устранил запрос к DB191.DBW82 при измении метки режима ручной/авто";Поднятие пресса на последней фазе было изменено со 150 мм до 200 мм.
17.01.2020;Шмарин А.М.;Резиносмешение;Mix 1.1 BY11 GK320;Small automatic chemistry/Автоматическая хим.развеска;Неисправен ПК. Ошибка RunTime error 5;В ходе диагностики была произведена неоднократно перезапись образа ПК. Привлечение Telco. После перезаписи образов не было возможности обновить файлы из за ошибок. Замена жесткого диска, запись образа, сброс обновлений от Telco. Пуск в работу.;
20.02.2021;Лазуткин И.С.;Резиносмешение;Mix 1.1 BY11 GK320;Intake;Не запускаеться разгрузка сажи с машины ;Проблема с датчиком наличия материала в  ведре стрейнера ( по магме находиться слева от rail container station).Установлен бай пасс в блоке fb1380 nt 2.( измен оператор с AN на A на прием сигнала с датчика 621B1).Необходимо проверить подключение и заменить датчик.Также нет обратной связи с датчика рчной задвижки на этом же узле 621B3 - установлен бай пасс в магме - необходима проверка сигнала.;
01.01.2015;Шмарин А.М.;Резиносмешение;Mix 1.1 BY11 GK320;WTS / Вальцы 2 машины;Некорректная работа подачи смазки ;Внесены изменения в проект BUZULUK FC 117 (MIX1_Maintanance), FC 167 (MIX2_Maintanance) и FC 217 (MIX3_Maintanance). Был исключен датчик протока смазки, вместо него заведены новые таймеры T9 (MIX1), T10 (MIX3), T11 (MIX2) в Network 11.;
01.01.2015;Шмарин А.М.;Резиносмешение;Mix 1.1 BY11 GK320;WTS / Вальцы 2 машины;Не работает пароль администратора;Внесены изменения в проект BUZULUK WinCC MIX1,2 и 3. Изменения коснулись смены пользователя и пароля администратора. Пользователь: asutp  Пароль: 1234 Так же были изменены пределы активации смазки вальцев.;
01.01.2015;Котлярский С.;Резиносмешение;Mix 1.2 BY12 GK270;Mixer/ Смеситель;Прес опускается вниз с большим гидравлическим ударом. Не доходя до нижнего положения начинает подниматься вверх.;По схемам нашли датчик на гидростанции сторона А. Датчик выдает сигнал 17 V, а должен от 0 до 10. На панеле =255 бар постоянно. Датчики поменяли местами, убедились, что ошибка на другую сторону (В) Поменяли датчик,откалибровали положение пресса. Все заработоло правильно;
01.01.2015;Золотарева Н.;Резиносмешение;Mix 1.2 BY12 GK271;Mills/ Вальцы;На вальцах, на блендере не увеличивается скорость;Скорость задается с пульта оператора, тумблером. Повернуть и удерживать- скорость должна увеличиваться.;
01.01.2015;Золотарева Н.;Резиносмешение;Mix 1.2 BY12 GK272;Computer;Не светится монитор  на 1 этаже;Был выключен компьютер в серверной. Включили.;
01.01.2015;Котлярский С.;Резиносмешение;Mix 1.2 BY12 GK273;Mills/ Вальцы;Не вращались 1-е вальцы, ошибка по воздуху;Был перекрыт воздух (с правой стороны, где моторы);
01.01.2015;Золотарева Н.;Резиносмешение;Mix 1.2 BY12 GK274;Computer;Ошибка связи с сервером.;Перегрузили компьютер - связь восстановилась.;
01.01.2015;Котлярский С.;Резиносмешение;Mix 1.2 BY12 GK275;Mills/ Вальцы;"Остановились 2-е вальцы, На панели ошибка ""минимальный уровень масла гидростанции""";Неисправен поплавок. Ремонт датчика.  ;
01.01.2015;Котлярский С.;Резиносмешение;Mix 1.2 BY12 GK276;Hydraulic unit/ Гидравлика;Машина не запускается.;В окне исходного состояния красным выделено давление масла, причина этого не выяснена,  через какое то время машина заработала. Написали письмо  в Telco.                                            ;
01.01.2015;Золотарева Н.;Резиносмешение;Mix 1.2 BY12 GK277;Computer;Попали на экран  из которого нет выхода;Перегрузили компьютер (мастер);
01.01.2015;Золотарева Н.;Резиносмешение;Mix 1.2 BY12 GK278;Batchoff/ Выгрузка;Высота укладки палет выше нормы;На выгрузке,  на  пульте  оператра  есть тумблер- высота укладки (низкая/высокая) , повернули в положение низкая . Высота укладки стала нормальной.;
01.01.2015;Золотарева Н.;Резиносмешение;Mix 1.2 BY12 GK279;Batchoff/ Выгрузка; Принтер на разгрузке не печатает.;"Принтер был выключен в системе управления ""МАГМА""";
01.01.2015;Котлярский С.;Резиносмешение;Mix 1.2 BY12 GK280;Mills/ Вальцы;Останов вальцев № 2 по ошибке блендера.;Неисправен конечный переключатель 74-SQ22/SIEMENS. Установлен отечественный аналог.;
01.01.2015;Золотарева Н.;Резиносмешение;Mix 1.2 BY12 GK281;Mills/ Вальцы;Вальцы № 2. Неправильный опрос датчика протока масла. (ошибка 44) в программе. Датчик отсоединен.;Внесены изменения в программу.  Датчик присоединен на место. ;
01.01.2015;Котлярский С.;Резиносмешение;Mix 1.2 BY12 GK282;Mills/ Вальцы;Часто останавливаются вальцы №1. На экране ошибки №№ 13,15,57,58,70,71,75. После сброса ошибок запускаются в работу.;Ошибка по сети Profibus (замечено мигание BF на интерфейсном модуле в шкафу +MX60). Замена коннектора Profibus.;
01.01.2015;Котлярский С.;Резиносмешение;Mix 1.2 BY12 GK283;Mills/ Вальцы;Вальцы № 1. Останов 2-го валка через несколко секунд после пуска. Не удается запустить несколько раз. Ошибка DRIVE 2 ALARM. На приводе ошибка F006. ;Проверка питающих напряжений. Нормально. На плате привода (под пластиковой крышкой) после пуска напряжение > 800 В.( В норме 540-570 В). Вальцы удалось запустить снизив скорость на пульте оператора с 80 RPM до 45 RPM. После этого напряжение на плате 540-570 В.;
01.01.2015;Золотарева Н.;Резиносмешение;Mix 1.2 BY12 GK284;Mills/ Вальцы;Не запускаются вальцы №1, на приводе ошибка F051;Сбросили ошибку на приводе. При повторном пуске появилась ошибка F 015, сбросили. Вальцы запустились;
01.01.2015;Золотарева Н.;Резиносмешение;Mix 1.2 BY12 GK285;Dosing rubber/ Дозирование каучуков;Не передается задание навески каучука на экран весов.;Сбросили ошибки , все передалось(Стрелочка под весами-сброс взвешивания- кнопки весы и конвейер);
01.01.2015;Котлярский С.;Резиносмешение;Mix 1.2 BY12 GK286;Mills/ Вальцы;Не вальцах №1 горит требование теста тормозов. Вальцы не запускаются.;Пробуем выполнить тест. После задания скорости 100 на экране brake появляется зеленая окошко READY. Нажимаем аварийную штангу. Надпись с экрана не пропадает. Делали несколько раз без результата. В программе FC102 nw 1 DB101.DBX32.3 вкл, когда появл. READY. В ветке nw2 не хватало DB101.DBX32.0. Переключил в 1. Надпись на экране c требованием теста пропала. Можно работать.;В меню Maintenance можно запустить заново отсчет времени 10 мин. 
01.01.2015;Золотарева Н.;Резиносмешение;Mix 1.2 BY12 GK287;Mills/ Вальцы;На вальцах №3,  нет развода ножей .;Нет входного сигнала на контроллере - положение  ножей( разбито контактное соединение) восстановили , работает;
01.01.2015;Золотарева Н.;Резиносмешение;Mix 1.2 BY12 GK288;Mills/ Вальцы;На вальцах №2 на панель оператора не выводятся данные и периодически отключаются  вальцы.;Плохой разъем Profibus на панели. Заменили разъем, все работает;
01.01.2015;Золотарева Н.;Резиносмешение;Mix 1.2 BY12 GK289;Batchoff/ Выгрузка;Нет движения транспортера ни в наладочном режиме, ни в автомате;Датчик определения поддона на столе с правой стороны перекрыт посторонним предметом. Убрали , все работает.;
01.01.2015;Золотарева Н.;Резиносмешение;Mix 1.2 BY12 GK290;Mills/ Вальцы;Периодически останавливаются вальцы №3 и иногда в этот момент     ( кратковременно)  на панели вместо данных появляются решетки.;Подтянула разъем Profibus на интерфейсном модуле  в шкафу с панелью ???;
01.01.2015;Золотарева Н.;Резиносмешение;Mix 1.2 BY12 GK291;Mills/ Вальцы;Не вальцах №1 горит требование теста тормозов. Вальцы не запускаются.; В программе в блоке FC102 nw 1 включила  DB101.DBX32.3 В ветке nw2 не хватало DB101.DBX32.0. переключила в 1. Надпись на экране c требованием теста пропала. Можно работать.;
01.01.2015;Котлярский С.;Резиносмешение;Mix 1.2 BY12 GK292;Mills/ Вальцы;Вальцы 3. На панели вместо данных решетки.;Снял питание и подал снова. После перезагрузки панели все работает.;
01.01.2015;Котлярский С.;Резиносмешение;Mix 1.2 BY12 GK293;Mills/ Вальцы;Периодически останавливаются вальцы №1 и  №3 Во время диагностики  заметили, кратковременно появляющуюся, ошибку по профибас ( MS51).;Плохой контакт в разъеме Profibus  на интерфейсном модуле в шкафу с панелью к вальцам №1. Заменили разъем.;
01.01.2015;Золотарева Н.;Резиносмешение;Mix 1.2 BY12 GK294;Mills/ Вальцы;Периодически останавливаются вальцы №1,№2, №3 ;Обнаружен плохой контакт  в разъеме Profibus  на интерфейсном модуле в шкафу МХ74; 
01.01.2015;Золотарева Н.;Резиносмешение;Mix 1.2 BY12 GK295;Mills/ Вальцы;Нa вальцах №1 горит требование теста тормозов. Вальцы не запускаются.;В программе в блоке FC102 nw 1 включила  DB101.DBX32.3 В ветке nw2 не хватало DB101.DBX32.0. переключила в 1. Надпись на экране c требованием теста пропала. Можно работать.;
01.01.2015;Золотарева Н.;Резиносмешение;Mix 1.2 BY12 GK296;Mills/ Вальцы;На вальцах №3,  нет развода ножей .;Нет входного сигнала положения  ножей на контроллере  ( разбито контактное соединение с датчика), восстановили , работает;
01.01.2015;Котлярский С.;Резиносмешение;Mix 1.2 BY12 GK297;Computer;"После выбора рецепта не происходит его запуск. На экране появляется ошибка ""MATERIAL NOT DEFINE IN SILOS"".";Проверили запуск другого рецепта - все идет нормально. Нужно разбираться с рецептом технологам R&D.;
