date;executor;region;equipment;node;notes_on_the_operation_of_the_equipment;measures_taken;comments
01.01.2015;Котлярский С.;Резиносмешение;CHEMICAL;Station/ Станция;Линия не запускается. Аварийное сообщение SERVER NOT AVAILABLE.;Перегрузил PIVORSAS. Результата нет ( пароль оператора не вводится, в поле вопросики). Перезагрузил компьютер PIVORVO2, все работает.;
01.01.2015;Золотарева Н.;Резиносмешение;CHEMICAL;Computer;Линия работает, но при запросе печати появляется ошибка  связи с сервером;Перезагрузила компьютер PIVORVO2,приэтом на пульте загрузки сажи экран монитора стал белым, ошибка сервера осталась. Перегрузила  PIVORSAS, ошибка сервера пропала, но экран на саже белый. Перегрузила PIVORSAM. Все работает.;
01.01.2015;Котлярский С.;Резиносмешение;CHEMICAL;Station/ Станция;"На экране  у последней станции  на весах появляется значек с ""!"" знаком (предположительно не идентифицируется ведро)";На датчике Peperl+Fushs (зеленая коробочка для идентификации) при определении ведра светодиод не  моргает. Перетерся кабель от датчика. Востановили, работает.;
01.01.2015;Котлярский С.;Резиносмешение;CHEMICAL;Computer;На компьютере PIVORV02 сообщение SERVER NOT AVAILABLE. На компьютере PIVORSAM вместо имени оператора абракадабра.;Перезагрузка PIVORSAS и PIVORSAM;
01.01.2015;Котлярский С.;Резиносмешение;CHEMICAL;Conveyor/ Конвейер;Сбой при движении ведер по конвейеру. Ведро останавливается не лоезжая до конвейера 3. Ведро, находящееся на конвейере 3 не доезжает до конца. На экране позиции ведер в середине и конце конвейера 3 мигают красным.;Сбился отражатель оптического датчика наличия ведра при подходе к конвейеру 3.  После регулировки датчика линия работает.;Конвейер 3 расположен вдоль(рядом) шкафов электрооборудования.
01.01.2015;;Резиносмешение;CHEMICAL;Station/ Станция;На 20-й станции не происходит навешивание химиката. Ошибок нет , ведро поднято для взвешивания, в окне на станцию пульсирующее сообщение( в 3-ей строке) - Dosing  parameters not found   ;Не определены параметры на набор веса .Вызвали технолога (Муромцева Дениса) , он под своим паролем задал параметры. Станция работает;
01.01.2015;Золотарева Н.;Резиносмешение;CHEMICAL;Aspiration/ Аспирация;"Не запускается линия , не включается ""вспомогательные""(аспирация). На большом мониторе сообщение-контроль вспомогательных частей нет разрешения.";На установке фильтрации, мешок для сбора отходов был втянут во внутрь установки и вероятно сработал датчик 511.5В6 входной сигнал Е167.0-Hopper high level probe. Поправили мешок , включилась аспирация в автоматическом режиме и появилась готовность линии.;
01.01.2015;Котлярский С.;Резиносмешение;CHEMICAL;Conveyor/ Конвейер;После отсутствия питающего напряжения на Контроллер и  PC Pivor 02 (202.2A4), и его востановлении не определяется ведро на станции 3. ; Некорректно востановилась связь блока управления Pepperl+Fuchs  (310.2А4) со считывающими головка  После перезагрузки компьютера Pivor 02 связь была востановлена. ;После отключения питания необходимо сбросить аварию кнопкой на шкафу 98+01
01.01.2015;Золотарева Н.;Резиносмешение;CHEMICAL;Aspiration/ Аспирация;Не включается в автоматическом  режиме;Датчик 511.5В6(находится внизу над мешком) был прижат мешком  и не вращался. Поправили , работает.;
01.01.2015;Юдаков А.;Резиносмешение;CHEMICAL;PLC;На экране не отображаются реальные значения, на месте значений отображаются вопросительные знаки, оборудование выделено цветом;Пропала связь контроллера с сервером Pivor SAS. Поменяли сетевой вход контроллера с первого на второй.(первый не пингуется даже напрямую к ноутбуку);Питание контроллера и ПК на резвеске химии осуществляется от ТП44 (внизу рядом с щитовой) фидер 16.  ЦРП 12  телефон 3812
01.01.2015;Котлярский С.;Резиносмешение;CHEMICAL;Computer;На компьютере невозможно отключить добавление ведра в меню ОТДЕЛЕНИЕ;На пульте оператора переключатель БЛОКА НАГРУЗА(Блокировка) был повернут вправо. Должен стоять в положении ВЛЕВО.;"
"
01.01.2015;Юдаков А.;Резиносмешение;CHEMICAL;Station/ Станция;Некорректное отображение позиций заслонки на станциях 1,2,3 и 4;"Станцию 3 и 4 привели в соответствие с 1 и 2 - в окне"" сылка HW"" к заслонке поставили байпас на открытие";
01.01.2015;Золотарева Н.;Резиносмешение;CHEMICAL;;Нет освещения у пульта оператора;Был ваключен УЗО(автомат) в щитке возле ТП-44 (помещение с фидерами) ;
01.01.2015;Юдаков А.;Резиносмешение;CHEMICAL;Station/ Станция;Были заменены датчики открытого положения заслонки (screw catchgate) на 1-4 станции.(проблему см. 03.04.15);Изменилась схема подключения датчиков, а сами датчики стали нормально-открытыми. Новые схемы в том же месте. Документ 002335-HDS-098_rev04_NEW.pdf Также был убран байпас на открытие заслонок этих станций.;
01.01.2015;Юдаков А.;Резиносмешение;CHEMICAL;Conveyor/ Конвейер;Не работает паяльник ;"Поправили датчик на цилиндре ""челюстей"". Для запуска паяльника оба нижних датчика должны быть активны. ";
01.01.2015;Юдаков А.;Резиносмешение;CHEMICAL;PLC;"7 станция подвечена красным в магме. Ошибка ""работа весов закончена с ошибкой"". ";Проверили тензодатчик(сигналы на выходе и входах модуля SIWAREX), меняли местами клемы на модуле с соседней станцией. Перезапускали линию. Результатов нет. Проблему решили после помощи Telco и калибровки всесов. ;
01.01.2015;Золотарева Н.;Резиносмешение;CHEMICAL;PLC;" На большом экране установелнном рядом с местом оператора горит одно и тоже сообщение: ""08 - ожидание команды. Проверка компьютера или данных на печать"".  Не передается рецепт в контроллер(задание не окрашивается в зеленый цвет ), аварийных сообщений нет . Линия не работает в автомате.";Перезагрузка компьютеров PIVORVO2, PIVORSAM, PIVORSAS результата не дала.  Писали в Telco.( Vat-таблица 80 проверяли 2 бита , должны быть 0);Проверяли , предположительно, DB2362.DBB4 и DB2362.DBB5 в  Vat 80
01.01.2015;Юдаков А.;Резиносмешение;CHEMICAL;; На большом экране установелнном рядом с местом оператора горит одно и тоже сообщение команды 05. Процес не идет в автоматическом режиме;Остановили линию. Удалилии и заново добавили ведро с присвоением ему номера. Запустили линию сбросили ошибки. ;При этом переодически требуется подтвержать дейсствия большой кнопкой на пульте оператора и сбрасывать аварии. 
14.04.2017;Котлярский С.;Резиносмешение;CHEMICAL;Conveyor/ Конвейер;Замена цилиндра 312.8В3 на цилиндр другого типа. При возврате штока цилиндра назад, шток пересекает датчик e 156.5 и нарушает работу авт. цикла  ;Внесены изменения в блок FB 2075 NW 6. Добавлена метка М 6401.0 и таймер Т 257 (3s).  Вместо входа E156.5 при вызове блока в этой цепи использована метка M6401.0;Cо стороны TELCO увеличено время ожидания ведра на след. позиции.
27.06.2017;Котлярский С.;Резиносмешение;CHEMICAL;PLC;" На большом экране установелнном рядом с местом оператора горит одно и тоже сообщение: ""08 - ожидание команды. Проверка компьютера или данных на печать"".   Линия не работает в автомате.";Перезагрузка компьютеров, выключение/включение результата не дало. Загрузка DB из ранее сохраненных. При  загрузке всех DB сразу у каэдого бункера внизу появился треугольник с восклиц. Знаком).Начал загружать примерно по 20-30 блоков и следить за сообщением на большом мониторе. Загружал по возрастанию.Последние 20-30 закончились на  DB2409. После этого картинка на большом мониторе сменилась и линия ожила. Пришлось заново удалять ведра с линии и калибровать несколько станций.  ;В такой ситуации лучше обращаться в TELCO. Дело было ночью и TELCO в этот раз не ответили.
06.02.2018;Котлярский С.;Резиносмешение;CHEMICAL;Conveyor/ Конвейер;Новый толкатель на 3-м конвейере иногда ломает ведра, если ведро немного не доходит до конечной позиции. При этом датчик 312.8B3 срабатывает.;Добавили дополнительный датчик 312.8B2. В условие включения таймера T257 (FB 2075? NW 6 добавили этот датчик (E156.0);
15.03.2018;Котлярский С.;Резиносмешение;CHEMICAL;Computer;Ошибки жесткого диска на порте 0 (Crystal Disk Info).;Замена жесткого диска.;
04.03.2019;Головин А.;Резиносмешение;CHEMICAL;PLC;" На большом экране установелнном рядом с местом оператора горит одно и тоже сообщение: ""08 - ожидание команды. Проверка компьютера или данных на печать"".  Не передается рецепт в контроллер(задание не окрашивается в зеленый цвет ), аварийных сообщений нет . Линия не работает в автомате.";Перезагрузка компьютеров PIVORVO2, PIVORSAM, PIVORSAS результата не дала.  Проверяли ,   DB2362.DBB4 и DB2362.DBB5. Они должны быть 0. В DB2362.DBB5 была 1. Через таблицу VAT сбросили в 0. Все заработало.;
18.06.2019;Головин А.;Резиносмешение;CHEMICAL;Station/ Станция;Нет питания в шкафу +96 - +98. Шкаф не используется потому что запаивание пакетов производить ручным запаивателем. Но от этого шкафа запитана розетка для ручного запаивателя. ;Как выяснолось не сработал датчик 321.2S5. Это датчик верхного  положения на правом  цилиндре. Из-за него не подавался сигнал Q154.0 с выхода контроллера на автомат 321.1Q3 для его включения.;
17.03.2021;Юдаков А.;Резиносмешение;CHEMICAL;Mini PC;Сообщение 23 - база дозирования не готова на экране miniPC. Не сбрасывается.;"Перезагрузка ПК, перезагрузка mini PC. Проверка каждого RFid. Поиск DB  в проекте связанном с данными miniPC. Обращение в Telco. После нескольких процедур восстановления результата нет. 
После проверки со стороны Telco были сброшены все ведра и рецепты вручную. После очередного запуска выяснилось, что наименование материала (RO1007AKO) бункера №13 не соответствовало запрошенному(RO1007AK0) (отличие в 1 символ), в результате чего машина не понимала какой материал использует и выдавала данное сообщение 23. То есть сообщение 23 возникает при несоответствии названия материала в бункере и заданного в рецепте.";
29.01.2018;Котлярский С.;Резиносмешение;MANUAL CHEMICAL;Станции измерительные;При опускании вниз диспенсер доходит до срабатывания цилиндра магнита, полностью не опускается.;1. Снять рецепт                                                                      2. Фаза ABORT(понажимать ПОДТВЕРДИТЬ, УДАЛИТЬ, ВЕСЫ ВОССТАНОВЛЕНИЕ пока не сбросятся все фазы).                                                            3. Поднимаем в автомате диспенсер вверх.                 4. Опускаем диспенсер вниз до момента, когда магнит должен отпустить болт.                                         5. Переводим в ручной режим,отключаем магнит и отводим болт.                                                                      6. В ручном режиме кнопками продолжаем опускать.;
01.01.2015;;Ошиповка;ATEC-100;;При переходе шиповальной головы с одной стороны шины на другую не происходит переключения видеоизображения на мониторе с одной камеры на другую. ;Сняли процеесор Omron, проверили контакты. Все заработало.;
23.11.2013;Копылов А.;Заключительные операции (УЗО);Acrodyne;Маркировка;"Ошибка ""Маркер 2 - закончилась краска"". Испытательный стенд не работает. При этом по факту краска в чернильнице есть.";"Система настроена таким образом, что при срабатывании маркера 6000 раз, она считает, что в его чернильнице заканчивается краска, не контролируя при этом фактический уровень краски. Для устранения проблемы нужно сбросить счетчик срабатываний на ноль: на панели Siemens в выплывающих меню выбрать ""Распределитель краски"" и ""Данные"" -> OK -> сбросить все счетчики на ноль.";
01.01.2015;Козинский В.;Заключительные операции (УЗО);Acrodyne;Станция намыливания;ошибка вход шины с хэндлера;толкатель наизмерительном стенде перекрывает датчик наличия покрышки при выходе после промазки, регулировка положения толкателя;
01.01.2015;Ярославцев С.;Заключительные операции (УЗО);Acrodyne;Computer;Состоянии аварийной остановки, невозможно вывести машину в исходное состояние при активированной не рабочей системе TGIS;"Один из способов. Для вывода машины в исходное необходимо при загрузке HMI нажимать кнопку ""Исходное"" на пульте оператора. Машина за время загрузки программы по чуть будет выходить в исходное состояние. Таких перезагрузок мне понадобилось около 10. Всё зависит от состояния останова. После выхода в исходное состояние деактивировать TGIS в настройках машины.";
23.11.2013;Копылов А.;Заключительные операции (УЗО);Acrodyne;Маркировка;"Ошибка ""Маркер 2 - закончилась краска"". Испытательный стенд не работает. При этом по факту краска в чернильнице есть.";"Система настроена таким образом, что при срабатывании маркера 6000 раз, она считает, что в его чернильнице заканчивается краска, не контролируя при этом фактический уровень краски. Для устранения проблемы нужно сбросить счетчик срабатываний на ноль: на панели Siemens в выплывающих меню выбрать ""Распределитель краски"" и ""Данные"" -> OK -> сбросить все счетчики на ноль.";
01.01.2015;Козинский В.;Заключительные операции (УЗО);Acrodyne;Станция намыливания;ошибка вход шины с хэндлера;толкатель наизмерительном стенде перекрывает датчик наличия покрышки при выходе после промазки, регулировка положения толкателя;
01.01.2015;Ярославцев С.;Заключительные операции (УЗО);Acrodyne;Computer;Состоянии аварийной остановки, невозможно вывести машину в исходное состояние при активированной не рабочей системе TGIS;"Один из способов. Для вывода машины в исходное необходимо при загрузке HMI нажимать кнопку ""Исходное"" на пульте оператора. Машина за время загрузки программы по чуть будет выходить в исходное состояние. Таких перезагрузок мне понадобилось около 10. Всё зависит от состояния останова. После выхода в исходное состояние деактивировать TGIS в настройках машины.";
23.11.2013;Копылов А.;Заключительные операции (УЗО);Acrodyne;Маркировка;"Ошибка ""Маркер 2 - закончилась краска"". Испытательный стенд не работает. При этом по факту краска в чернильнице есть.";"Система настроена таким образом, что при срабатывании маркера 6000 раз, она считает, что в его чернильнице заканчивается краска, не контролируя при этом фактический уровень краски. Для устранения проблемы нужно сбросить счетчик срабатываний на ноль: на панели Siemens в выплывающих меню выбрать ""Распределитель краски"" и ""Данные"" -> OK -> сбросить все счетчики на ноль.";
01.01.2015;Козинский В.;Заключительные операции (УЗО);Acrodyne;Станция намыливания;ошибка вход шины с хэндлера;толкатель наизмерительном стенде перекрывает датчик наличия покрышки при выходе после промазки, регулировка положения толкателя;
01.01.2015;Ярославцев С.;Заключительные операции (УЗО);Acrodyne;Computer;Состоянии аварийной остановки, невозможно вывести машину в исходное состояние при активированной не рабочей системе TGIS;"Один из способов. Для вывода машины в исходное необходимо при загрузке HMI нажимать кнопку ""Исходное"" на пульте оператора. Машина за время загрузки программы по чуть будет выходить в исходное состояние. Таких перезагрузок мне понадобилось около 10. Всё зависит от состояния останова. После выхода в исходное состояние деактивировать TGIS в настройках машины.";
